{
  "request_id": "m68_private_audit_report_request",
  "version": "0.1.0",
  "created_at": "2026-06-21T00:00:00Z",
  "status": "public_safe_private_audit_report_fixture",
  "source_vault_manifest_path": "traces/external/private_evidence_vault_manifest.example.json",
  "source_metadata_classification": "public_safe_fake_private_metadata",
  "report_label": "private_audit_report",
  "report_classification": "private_audit_report",
  "output_defaults": {
    "private_report_root": "reports/private/",
    "private_report_root_gitignored": true,
    "json_path": "reports/private/m68_private_audit_report.local.json",
    "markdown_path": "reports/private/m68_private_audit_report.local.md",
    "local_only_by_default": true,
    "private_reports_committable": false,
    "summary_json_path": "reports/comparisons/private_audit_report_boundary_summary.json",
    "summary_markdown_path": "reports/comparisons/private_audit_report_boundary_summary.md"
  },
  "aggregate_export_policy": {
    "enabled_by_default": false,
    "public_safe_by_default": true,
    "aggregate_only": true,
    "per_record_private_details_in_export": false,
    "output_path": "reports/comparisons/private_audit_report_boundary_summary.json"
  },
  "report_controls": {
    "private_report_label_required": true,
    "reports_generated_from_private_evidence_marked_private_audit": true,
    "local_only_by_default": true,
    "private_reports_gitignored": true,
    "private_reports_committable": false,
    "report_contains_raw_private_evidence": false,
    "report_contains_credentials_or_secrets": false,
    "report_contains_private_workspace_paths": false,
    "report_contains_real_customer_data": false,
    "gated_llm_review_required": false,
    "public_leaderboard_eligible": false,
    "production_safety_claim": false,
    "third_party_reproducibility_claim": false,
    "private_audit_overclaim": false
  },
  "quality_gate": {
    "deterministic_gate_uses_fake_metadata_only": true,
    "private_evidence_ingestion_in_quality_gate": false,
    "raw_private_data_read_in_quality_gate": false,
    "live_execution_in_quality_gate": false,
    "credential_handling_in_quality_gate": false,
    "provider_calls_in_quality_gate": false,
    "browser_email_network_shell_actions_in_quality_gate": false,
    "external_actions_in_quality_gate": false,
    "gated_llm_review_in_quality_gate": false
  },
  "safety_assertions": {
    "public_safe_input_metadata": true,
    "contains_raw_private_evidence": false,
    "contains_credentials_or_secrets": false,
    "contains_private_workspace_paths": false,
    "contains_real_customer_data": false,
    "live_provider_model_runtime_execution": false,
    "browser_email_network_shell_external_actions": false,
    "public_leaderboard_claim": false,
    "production_safety_claim": false,
    "third_party_reproducibility_claim": false,
    "private_audit_overclaim": false
  },
  "included_private_record_ids": [
    "fake_private_runtime_trace_001",
    "fake_private_tool_summary_001"
  ],
  "report_sections": [
    {
      "section_id": "scope",
      "title": "Scope",
      "source": "metadata_only",
      "aggregate_only": true,
      "raw_private_evidence_allowed": false,
      "private_values_allowed": false
    },
    {
      "section_id": "evidence_inventory",
      "title": "Evidence Inventory",
      "source": "metadata_only",
      "aggregate_only": true,
      "raw_private_evidence_allowed": false,
      "private_values_allowed": false
    },
    {
      "section_id": "redaction_readiness",
      "title": "Redaction Readiness",
      "source": "metadata_only",
      "aggregate_only": true,
      "raw_private_evidence_allowed": false,
      "private_values_allowed": false
    },
    {
      "section_id": "boundaries",
      "title": "Boundaries",
      "source": "metadata_only",
      "aggregate_only": true,
      "raw_private_evidence_allowed": false,
      "private_values_allowed": false
    }
  ]
}
